{
  "schema_version": "org.searchright.provider-page.v1",
  "records": [
    {
      "schema_version": "org.searchright.bibliographic-record.v1",
      "source_receipt_id": "pending-receipt",
      "kind": "journal_article",
      "identifiers": {
        "doi": "10.1000/searchright.4",
        "pmid": null,
        "pmcid": null,
        "trial_registration": null,
        "openalex": null,
        "isbn": null,
        "other": {}
      },
      "abstract_text": null,
      "authors": [
        "D, Fixture"
      ],
      "container_title": "Searchright Fixture Journal",
      "publication_year": 2026,
      "publication_date": null,
      "languages": [],
      "subjects": [],
      "urls": [
        "https://doi.org/10.1000/searchright.4"
      ],
      "record_id": "crossref-10.1000/searchright.4",
      "native_id": "10.1000/searchright.4",
      "title": "Synthetic Crossref fixture",
      "provider_metadata": {
        "DOI": "10.1000/searchright.4",
        "title": [
          "Synthetic Crossref fixture"
        ],
        "author": [
          {
            "given": "Fixture",
            "family": "D"
          }
        ],
        "container-title": [
          "Searchright Fixture Journal"
        ],
        "published-online": {
          "date-parts": [
            [
              2026,
              2,
              1
            ]
          ]
        },
        "URL": "https://doi.org/10.1000/searchright.4",
        "type": "journal-article"
      }
    }
  ],
  "next_cursor": "DnF1ZXJ5VGhlbkZldGNoBQAAAAA=",
  "total_available": 1,
  "diagnostics": {}
}
