{
  "schema_version": "org.searchright.provider-page.v1",
  "records": [
    {
      "schema_version": "org.searchright.bibliographic-record.v1",
      "source_receipt_id": "pending-receipt",
      "kind": "journal_article",
      "identifiers": {
        "doi": "10.1000/searchright.3",
        "pmid": "00000003",
        "pmcid": "PMC0000003",
        "trial_registration": null,
        "openalex": null,
        "isbn": null,
        "other": {}
      },
      "abstract_text": "Rights-clear synthetic metadata for deterministic parsing tests.",
      "authors": [
        "Fixture C"
      ],
      "container_title": "Searchright Fixture Journal",
      "publication_year": 2026,
      "publication_date": null,
      "languages": [],
      "subjects": [],
      "urls": [],
      "record_id": "europe-pmc:3:MED:8:00000003",
      "native_id": "00000003",
      "title": "Synthetic Europe PMC fixture",
      "provider_metadata": {
        "id": "00000003",
        "source": "MED",
        "pmid": "00000003",
        "pmcid": "PMC0000003",
        "doi": "10.1000/searchright.3",
        "title": "Synthetic Europe PMC fixture",
        "authorString": "Fixture C",
        "journalTitle": "Searchright Fixture Journal",
        "pubYear": "2026",
        "abstractText": "Rights-clear synthetic metadata for deterministic parsing tests."
      }
    }
  ],
  "next_cursor": "AoIIP4fQ1yg1NTQzMzQ0MQ==",
  "total_available": 1,
  "diagnostics": {}
}
